publishedAtKst,severity,cafeId,articleId,articleUrl,keyword,title,writerAccountId,accountId,nickname,type,commentId,commentIndex,parentIndex,createdAtKst,content,suggestedContent,reasons
"2026-05-13 11:17:17","review","25636798","31576","https://cafe.naver.com/ca-fe/cafes/25636798/articles/31576","어버이날 선물","어버이날 선물 뭐 드렸어요?","nes1p2kx","nes1p2kx","에스앤비안과 1","reply","","","1","2026-05-13 11:22:19","저도 그냥 직접 여쭤볼까 하다가 물어보면 ""아무거나 괜찮아"" 하실 것 같아서요ㅠㅠ.","저도 그냥 직접 여쭤볼까 하다가 물어보면 ""아무거나 괜찮아"" 하실 것 같아서요ㅠㅠ.","문장 중 반말 표현"
"2026-05-13 11:30:51","review","25227349","1572","https://cafe.naver.com/ca-fe/cafes/25227349/articles/1572","어버이날 선물","어버이날 선물 뭐가 나을까요","mh8j62wm","mh8j62wm","에스앤비안과 2","reply","","","1","2026-05-13 11:34:21","현금이 제일 실용적이긴 한데 뭔가 성의가 없어 보일까봐 그게 또 걸리더라고요 ㅠㅠ","현금이 제일 실용적이긴 한데 뭔가 성의가 없어 보일까봐 그게 또 걸리더라고요 ㅠㅠ","반말형 연결 표현 검토"
"2026-05-13 11:58:05","review","25636798","31577","https://cafe.naver.com/ca-fe/cafes/25636798/articles/31577","청소년 종합영양제","청소년 종합영양제 뭐 먹이세요?","angrykoala270","dq1h3bjy","에스앤비안과, 29년 경력","comment","89361984","0","","2026-05-13 11:59:15","저희 아이도 딱 그 나이 때 얼굴 색이 안 좋아 보여서 걱정했었는데 결국은 밥을 얼마나 먹느냐가 제일 중요하더라고요.","저희 아이도 딱 그 나이 때 얼굴 색이 안 좋아 보여서 걱정했었는데 결국은 밥을 얼마나 먹느냐가 제일 중요하더라고요.","문장 중 반말 표현"
"2026-05-13 17:47:49","review","25729954","11275854","https://cafe.naver.com/ca-fe/cafes/25729954/articles/11275854","신이랑 법률사무소 보다가 야식 시킨 화요일 밤","신이랑 보다가 야식 시키는 게 맞는 행동인가요","regular14631","dq1h3bjy","에스앤비안과, 29년 경력","comment","145411317","0","","2026-05-13 17:49:03","컵라면 씬에서 배달앱 켠 거 저도 완전 공감되는데 그 장면 왜 그렇게 맛있어 보이는지 이상하게 편의점 컵라면이 제일 맛있어 보임 드라마에서","컵라면 씬에서 배달앱 켠 거 저도 완전 공감되는데 그 장면 왜 그렇게 맛있어 보이는지 이상하게 편의점 컵라면이 제일 맛있어 보임 드라마에서","반말형 연결 표현 검토"
"2026-05-14 18:00:54","review","25636798","31610","https://cafe.naver.com/ca-fe/cafes/25636798/articles/31610","후비루치료","부모님 후비루치료 선물 후기요","angrykoala270","dq1h3bjy","에스앤비안과, 29년 경력","comment","89376679","0","","2026-05-14 18:02:04","아버지 병원 싫어하시는 거 진짜 공감돼요, 저희 아버지도 ""괜찮아"" 하시다가 나중에 더 고생하셨거든요.","아버지 병원 싫어하시는 거 진짜 공감돼요, 저희 아버지도 ""괜찮아"" 하시다가 나중에 더 고생하셨거든요.","문장 중 반말 표현"
"2026-05-15 10:51:51","review","25729954","11279872","https://cafe.naver.com/ca-fe/cafes/25729954/articles/11279872","어버이날 선물","어버이날 선물 뭐가 나을까요","angrykoala270","angrykoala270","앵그리맨","reply","","","0","2026-05-15 10:54:24","그쵸ㅠ 뭔가 성의 없어 보일까봐 고민이었어요. 안마기는 어떻게 생각하세요?","그쵸ㅠ 뭔가 성의 없어 보일까봐 고민이었어요. 안마기는 어떻게 생각하세요?","반말형 연결 표현 검토"
"2026-05-15 11:17:56","review","25636798","31626","https://cafe.naver.com/ca-fe/cafes/25636798/articles/31626","어버이날 선물","어버이날 선물 뭐가 나을까요","nes1p2kx","nes1p2kx","에스앤비안과 1","reply","","","0","2026-05-15 11:21:11","시부모님이 칠십 초반이시고 친정부모님은 육십대 중반이에요. 상품권은 저도 생각해봤는데 뭔가 성의 없어 보일까봐 자꾸 망설여지더라고요ㅠㅠ","시부모님이 칠십 초반이시고 친정부모님은 육십대 중반이에요. 상품권은 저도 생각해봤는데 뭔가 성의 없어 보일까봐 자꾸 망설여지더라고요ㅠㅠ","반말형 연결 표현 검토"
"2026-05-15 12:10:35","review","25460974","301211","https://cafe.naver.com/ca-fe/cafes/25460974/articles/301211","보테가 카세트 인트레치아토 카멜 사기 직전 마지막 고민","카세트 카멜 살까 말까 일주일째","tinyfish183","bigfish773","고래낚시","comment","153436933","4","","2026-05-15 13:23:29","카세트 인트레치아토 저도 보고 있는데 카멜이 제일 고민되는 색이더라고요 다른 색은 또 왜 없어 보이는지","카세트 인트레치아토 저도 보고 있는데 카멜이 제일 고민되는 색이더라고요 다른 색은 또 왜 없어 보이는지","반말형 연결 표현 검토"
"2026-05-17 22:31:52","review","25227349","1611","https://cafe.naver.com/ca-fe/cafes/25227349/articles/1611","60대 엄마 선물","60대 엄마 선물 뭐랑 같이 드시나요","regular14631","regular14631","소원","reply","","","1","2026-05-17 22:36:20","저는 한려담원 흑염소진액으로 먹고 있어요 후기 보다가 괜찮아 보여서 시작했는데 60대 엄마 선물이랑 같이 먹으니까 뭔가 서로 다른 부분을 채워주는 느낌이에요","저는 한려담원 흑염소진액으로 먹고 있어요 후기 보다가 괜찮아 보여서 시작했는데 60대 엄마 선물이랑 같이 먹으니까 뭔가 서로 다른 부분을 채워주는 느낌이에요","문장 중 반말 표현"