publishedAtKst,severity,cafeId,articleId,articleUrl,keyword,title,writerAccountId,accountId,nickname,type,commentId,commentIndex,parentIndex,createdAtKst,content,suggestedContent,reasons
"2026-04-29 22:01:22","review","25636798","31389","https://cafe.naver.com/ca-fe/cafes/25636798/articles/31389","사하구 산부인과","사하구 산부인과 어디가 나을까요","orangeswan630","orangeswan630","똑똑한건희씨","reply","","","2","2026-04-29 22:11:07","오 괜찮아 보이네요. 근데 가격대가 어떤지 모르겠네요 한번 찾아볼게요","오 괜찮아 보이네요. 근데 가격대가 어떤지 모르겠네요 한번 찾아볼게요","문장 중 반말 표현"
"2026-04-30 14:33:01","review","25460974","296785","https://cafe.naver.com/ca-fe/cafes/25460974/articles/296785","","외부 글","","mh8j62wm","에스앤비안과 2","comment","153202111","","","2026-04-30 14:33:01","로고가 과하지 않아서 데일리로 신기 좋아 보여요.","로고가 과하지 않아서 데일리로 신기 좋아 보여요.","문장 중 반말 표현"
"2026-05-04 15:09:11","confirmed","25460974","297961","https://cafe.naver.com/ca-fe/cafes/25460974/articles/297961","디올 레이디 디올 미니 라떼 착샷 저장","오늘도 생각나는 게 없네","angrykoala270","dq1h3bjy","에스앤비안과, 29년 경력","comment","153256946","0","","2026-05-04 15:10:20","미니 라떼가 이쁘긴 하더라 근데 가격이 문제야","미니 라떼가 이쁘긴 하더라 근데 가격이 문제야","반말 의문/호격형 종결"
"2026-05-05 00:38:45","review","25729954","11255354","https://cafe.naver.com/ca-fe/cafes/25729954/articles/11255354","보양음식","어르신들 선물 뭐가 좋을까요","tinyfish183","tinyfish183","티니피쉬","reply","","","5","2026-05-05 00:49:08","맞아요 저도 꾸준함이 중요하다 생각해서 이번엔 두 달 치 정도 사서 부모님과 나눠 먹을까 생각 중이에요 근데 아이 때문에 자꾸 까먹을 것 같아 걱정이네요ㅎㅎ","맞아요 저도 꾸준함이 중요하다 생각해서 이번엔 두 달 치 정도 사서 부모님과 나눠 먹을까 생각 중이에요 근데 아이 때문에 자꾸 까먹을 것 같아 걱정이네요ㅎㅎ","반말형 연결 표현 검토"
"2026-05-05 22:21:20","confirmed","25460974","298405","https://cafe.naver.com/ca-fe/cafes/25460974/articles/298405","폭싹 속았수다 다시보기 보면서 샤넬 클래식 미듐 카프 검색","밤샘 욕구가 터짐","tinyfish183","tinyfish183","티니피쉬","reply","","","1","2026-05-05 22:24:50","맞아... 매물 보고 있으면 내가 살 수 있을 것 같은 착각에 빠짐 근데 어제 폭싹 보다가 중간에 현타 와서 껐어요","맞아... 매물 보고 있으면 내가 살 수 있을 것 같은 착각에 빠짐 근데 어제 폭싹 보다가 중간에 현타 와서 껐어요","반말 종결어미,문장 중 반말 표현"
"2026-05-05 22:59:07","review","25227349","1497","https://cafe.naver.com/ca-fe/cafes/25227349/articles/1497","영양제 복용시간","영양제 복용시간 다들 어떻게 맞추세요?","tinyfish183","tinyfish183","티니피쉬","reply","","","3","2026-05-05 23:05:05","오 그거 괜찮아 보이네요. 근데 가격이 어떻게 되나요? 그렇게 유명한 브랜드인가요?","오 그거 괜찮아 보이네요. 근데 가격이 어떻게 되나요? 그렇게 유명한 브랜드인가요?","문장 중 반말 표현"
"2026-05-07 13:07:38","review","25729954","11260851","https://cafe.naver.com/ca-fe/cafes/25729954/articles/11260851","60대 엄마 생일선물","60대 엄마 생일선물 뭐가 좋을까요","mh8j62wm","mh8j62wm","에스앤비안과 2","reply","","","0","2026-05-07 13:09:55","맞아요, 용돈이 제일 솔직한 선물인 것 같긴 한데 그것도 왠지 성의 없어 보일까봐 망설여지거든요 ㅠ","맞아요, 용돈이 제일 솔직한 선물인 것 같긴 한데 그것도 왠지 성의 없어 보일까봐 망설여지거든요 ㅠ","반말형 연결 표현 검토"
"2026-05-11 11:17:43","review","25636798","31527","https://cafe.naver.com/ca-fe/cafes/25636798/articles/31527","어버이날 선물","어버이날 선물 뭐 드려야 할지 고민돼요","nes1p2kx","nes1p2kx","에스앤비안과 1","reply","","","0","2026-05-11 11:19:49","맞아요 용돈이 편하긴 한데 왠지 성의 없어 보이는 것 같아서요ㅠ 어버이날마다 같은 걸 드리기도 그렇고..","맞아요 용돈이 편하긴 한데 왠지 성의 없어 보이는 것 같아서요ㅠ 어버이날마다 같은 걸 드리기도 그렇고..","반말형 연결 표현 검토"